{
  "$schema": "https://json-schema.org/draft/2020-12/schema",
  "$id": "https://probity.dev/schemas/verifier-output.schema.json",
  "title": "Verifier Output (verifier-output:v1)",
  "type": "object",
  "additionalProperties": false,
  "required": [
    "record_id",
    "verification_time",
    "status",
    "status_reasons",
    "canonical_serialization_id",
    "integrity"
  ],
  "properties": {
    "record_id": { "type": "string", "minLength": 1 },
    "verification_time": { "$ref": "#/$defs/timestamp" },

    "status": {
      "type": "string",
      "enum": ["verified", "unverified", "invalid", "incomplete"]
    },

    "status_reasons": {
      "type": "array",
      "items": {
        "anyOf": [
            { "$ref": "https://probity.dev/schemas/enums/verification-reasons.json" },
            { "type": "string", "pattern": "^[A-Za-z0-9_]+(\\.[A-Za-z0-9_]+)+$" }
        ]
      }
    },

    "canonical_serialization_id": {
      "type": "string",
      "minLength": 1
    },

    "integrity": {
      "type": "object",
      "additionalProperties": false,
      "required": ["hash_algo", "hash_encoding", "computed_digest", "expected_digest", "match"],
      "properties": {
        "hash_algo": { "type": "string", "minLength": 1 },
        "hash_encoding": { "type": "string", "enum": ["hex", "base64url"] },
        "computed_digest": { "type": "string", "minLength": 1 },
        "expected_digest": { "type": "string", "minLength": 1 },
        "match": { "type": "boolean" }
      }
    },

    "signature": {
      "type": "object",
      "additionalProperties": false,
      "required": ["signer_key_id", "signature_algo", "target", "signature_valid"],
      "properties": {
        "signer_key_id": { "type": "string", "minLength": 1 },
        "signature_algo": { "type": "string", "minLength": 1 },
        "target": { "type": "string", "enum": ["snapshot_bytes", "snapshot_digest"] },
        "signature_valid": { "type": "boolean" }
      }
    },

    "missing_fields": {
      "type": "array",
      "items": {
        "anyOf": [
            { "$ref": "https://probity.dev/schemas/enums/verification-reasons.json" },
            { "type": "string", "pattern": "^[A-Za-z0-9_]+(\\.[A-Za-z0-9_]+)+$" }
        ]
      }
    },

    "evidence_quality": {
    "$ref": "https://probity.dev/schemas/enums/evidence-quality.json"
    },

    "notes": { "type": "string" },

    "extensions": { "$ref": "#/$defs/extensions" }
  },

  "$defs": {
    "timestamp": {
      "type": "string",
      "pattern": "^\\d{4}-\\d{2}-\\d{2}T\\d{2}:\\d{2}:\\d{2}(?:\\.\\d{1,9})?Z$"
    },
    "extensions": {
      "type": "object",
      "propertyNames": { "pattern": "^[A-Za-z0-9_]+(\\.[A-Za-z0-9_]+)+$" },
      "additionalProperties": true
    }
  }
}