{
  "record_id": "tv-06",
  "verification_time": "1970-01-01T00:00:00Z",
  "status": "incomplete",
  "status_reasons": [
    "missing_snapshot_fields"
  ],
  "canonical_serialization_id": "jcs:rfc8785",
  "integrity": {
    "hash_algo": "sha256",
    "hash_encoding": "hex",
    "computed_digest": "39e2d51988a7c48554d99a3b3c39aca286de8a064daf1d97fb4a45f242fae593",
    "expected_digest": "39e2d51988a7c48554d99a3b3c39aca286de8a064daf1d97fb4a45f242fae593",
    "match": true
  },
  "evidence_quality": "incomplete",
  "missing_fields": [
    "outcome"
  ]
}
