{
  "record_id": "tv-05",
  "verification_time": "1970-01-01T00:00:00Z",
  "status": "verified",
  "status_reasons": [],
  "canonical_serialization_id": "jcs:rfc8785",
  "integrity": {
    "hash_algo": "sha256",
    "hash_encoding": "hex",
    "computed_digest": "343dd03af0a817ecc90a33c281367976fc335fec54bdf9c9561277a3c37cfa8a",
    "expected_digest": "343dd03af0a817ecc90a33c281367976fc335fec54bdf9c9561277a3c37cfa8a",
    "match": true
  },
  "evidence_quality": "late"
}
